{
  "$schema": "https://json-schema.org/draft/2020-12/schema",
  "$id": "https://fractured-trust.local/tooling/pipeline-viewer/pipeline.schema.json",
  "title": "pipeline.json",
  "description": "Manifest of canonical scripts required to reproduce a study's analytical pipeline. Consumed by tooling/pipeline-viewer/.",
  "type": "object",
  "required": ["study", "steps"],
  "additionalProperties": true,
  "properties": {
    "study": {
      "type": "string",
      "description": "Short identifier of the study this pipeline belongs to (e.g. 'study2-chile-v2')."
    },
    "target": {
      "type": "string",
      "description": "One-paragraph statement of what the pipeline produces and the identification strategy it implements."
    },
    "version": {
      "type": "integer",
      "minimum": 0,
      "description": "Manifest schema version for the *study* (not for this JSON Schema). Bump when canonical step set changes meaningfully."
    },
    "last_updated": {
      "type": "string",
      "format": "date",
      "pattern": "^\\d{4}-\\d{2}-\\d{2}$",
      "description": "ISO date the manifest was last edited."
    },
    "notes": {
      "type": "array",
      "items": { "type": "string" },
      "description": "Free-form notes about conventions, exclusions, and how to keep the manifest in sync."
    },
    "steps": {
      "type": "array",
      "minItems": 1,
      "items": { "$ref": "#/$defs/step" }
    }
  },
  "$defs": {
    "step": {
      "type": "object",
      "required": ["step", "label", "path"],
      "additionalProperties": true,
      "properties": {
        "step": {
          "type": "string",
          "minLength": 1,
          "description": "Canonical id (typically a zero-padded ordinal: '00', '01', '10', '10a')."
        },
        "label": {
          "type": "string",
          "minLength": 1,
          "description": "Short human-readable label (snake_case recommended). Should match the script's stem."
        },
        "path": {
          "type": "string",
          "minLength": 1,
          "description": "Relative path from the study root to the script."
        },
        "language": {
          "type": "string",
          "description": "Implementation language. Suggested values: 'python', 'R', 'sh', 'stata', 'matlab'. Open enum."
        },
        "stage": {
          "type": "string",
          "description": "Pipeline stage the step belongs to (e.g. 'data_prep', 'crosswalk', 'imputed_positions', 'estimation'). Open enum."
        },
        "status": {
          "type": "string",
          "description": "Implementation status. Suggested values: 'implemented', 'todo'. Open enum; the viewer renders unknown values as a neutral pill.",
          "examples": ["implemented", "todo"]
        },
        "description": {
          "type": "string",
          "description": "Plain-text paragraph describing what the step does. Rendered as preformatted text in the viewer; newlines preserved."
        },
        "inputs": {
          "type": "array",
          "items": { "type": "string" },
          "description": "Paths or glob patterns the step reads."
        },
        "outputs": {
          "type": "array",
          "items": { "type": "string" },
          "description": "Paths the step writes."
        },
        "depends_on": {
          "type": "array",
          "items": { "type": "string" },
          "uniqueItems": true,
          "description": "List of step ids this step depends on. Must reference existing step ids and form an acyclic graph (enforced by tooling/pipeline-viewer/check.py, not the schema)."
        }
      }
    }
  }
}
